case_or_authority,court,date,topic,holding_summary,contract_review_use
"CJEU C-300/21, Oesterreichische Post, EU:C:2023:370",Court of Justice of the European Union,2023-05-04,GDPR Art. 82 non-material damage,"Mere GDPR infringement is not enough for compensation, but there is no seriousness threshold for non-material damage.",Use in damages-risk explanations and to avoid overclaiming automatic compensation.
"CJEU C-340/21, Natsionalna agentsia za prihodite, EU:C:2023:986",Court of Justice of the European Union,2023-12-14,Security measures and fear of misuse,Security appropriateness is assessed concretely; fear of data misuse can itself be non-material damage.,"Supports detailed TOM annex, breach evidence, and incident-response obligations."
"CJEU C-456/22, Gemeinde Ummendorf, EU:C:2023:988",Court of Justice of the European Union,2023-12-14,German-origin GDPR damages reference,"No de minimis threshold applies, but claimant must show consequences that differ from the mere infringement.",Useful for German claimant-risk discussion and settlement valuation.
"CJEU C-667/21, Krankenversicherung Nordrhein, EU:C:2023:1022",Court of Justice of the European Union,2023-12-21,Health and employee-related data; Art. 82,Processing sensitive employee-related health data raises strict lawful-basis and compensation analysis.,"Supports escalation where employee, health, or workplace monitoring data is in scope."
BGH VI ZR 10/24,Bundesgerichtshof,2024-11-18,Facebook scraping and loss of control,Short-term loss of control over personal data can be non-material damage under GDPR Art. 82.,Use in German litigation and mass-claim risk framing after data incidents.
